{
  "boardLook": "icons",
  "definitionVersion": 1,
  "difficulty": {
    "class": "hard",
    "score": 3078
  },
  "entries": [
    {
      "side": "right",
      "x": 21,
      "y": 9
    }
  ],
  "generatorVersion": "gen-1.3.0",
  "levelNumber": 4523,
  "locks": [
    {
      "keyId": "k1",
      "target": {
        "id": "4",
        "kind": "slot"
      }
    }
  ],
  "mapping": {
    "bell": "wood",
    "curtain": "berry",
    "floor": "moss",
    "keys": "dew",
    "mouth": "flower",
    "notes": "moss",
    "sax": "vine",
    "wall": "dew"
  },
  "mechanics": ["locked_slot"],
  "overlays": {
    "cells": [
      {
        "keyId": "k1",
        "x": 21,
        "y": 8
      }
    ]
  },
  "picture": {
    "id": "saxophone_10",
    "version": 1
  },
  "pods": [
    {
      "count": 13,
      "id": "p01",
      "variantId": "berry"
    },
    {
      "count": 15,
      "id": "p02",
      "variantId": "berry"
    },
    {
      "count": 7,
      "id": "p03",
      "variantId": "berry"
    },
    {
      "count": 8,
      "id": "p04",
      "variantId": "berry"
    },
    {
      "count": 13,
      "id": "p05",
      "variantId": "berry"
    },
    {
      "count": 8,
      "id": "p06",
      "variantId": "berry"
    },
    {
      "count": 10,
      "id": "p07",
      "variantId": "vine"
    },
    {
      "count": 8,
      "id": "p08",
      "variantId": "berry"
    },
    {
      "count": 6,
      "id": "p09",
      "variantId": "dew"
    },
    {
      "count": 9,
      "id": "p10",
      "variantId": "dew"
    },
    {
      "count": 7,
      "id": "p11",
      "variantId": "moss"
    },
    {
      "count": 7,
      "id": "p12",
      "variantId": "dew"
    },
    {
      "count": 8,
      "id": "p13",
      "variantId": "dew"
    },
    {
      "count": 9,
      "id": "p14",
      "variantId": "vine"
    },
    {
      "count": 13,
      "id": "p15",
      "variantId": "berry"
    },
    {
      "count": 6,
      "id": "p16",
      "variantId": "flower"
    },
    {
      "count": 7,
      "id": "p17",
      "variantId": "dew"
    },
    {
      "count": 10,
      "id": "p18",
      "variantId": "dew"
    },
    {
      "count": 15,
      "id": "p19",
      "variantId": "dew"
    },
    {
      "count": 5,
      "id": "p20",
      "variantId": "wood"
    },
    {
      "count": 15,
      "id": "p21",
      "variantId": "dew"
    },
    {
      "count": 8,
      "id": "p22",
      "variantId": "dew"
    },
    {
      "count": 8,
      "id": "p23",
      "variantId": "dew"
    },
    {
      "count": 8,
      "id": "p24",
      "variantId": "dew"
    },
    {
      "count": 8,
      "id": "p25",
      "variantId": "dew"
    },
    {
      "count": 15,
      "id": "p26",
      "variantId": "dew"
    },
    {
      "count": 7,
      "id": "p27",
      "variantId": "vine"
    },
    {
      "count": 15,
      "id": "p28",
      "variantId": "moss"
    },
    {
      "count": 15,
      "id": "p29",
      "variantId": "vine"
    },
    {
      "count": 8,
      "id": "p30",
      "variantId": "vine"
    },
    {
      "count": 8,
      "id": "p31",
      "variantId": "vine"
    },
    {
      "count": 14,
      "id": "p32",
      "variantId": "vine"
    },
    {
      "count": 14,
      "id": "p33",
      "variantId": "vine"
    },
    {
      "count": 7,
      "id": "p34",
      "variantId": "vine"
    },
    {
      "count": 7,
      "id": "p35",
      "variantId": "vine"
    },
    {
      "count": 9,
      "id": "p36",
      "variantId": "vine"
    },
    {
      "count": 15,
      "id": "p37",
      "variantId": "vine"
    },
    {
      "count": 13,
      "id": "p38",
      "variantId": "dew"
    },
    {
      "count": 11,
      "id": "p39",
      "variantId": "dew"
    },
    {
      "count": 10,
      "id": "p40",
      "variantId": "dew"
    },
    {
      "count": 12,
      "id": "p41",
      "variantId": "dew"
    },
    {
      "count": 12,
      "id": "p42",
      "variantId": "dew"
    },
    {
      "count": 11,
      "id": "p43",
      "variantId": "dew"
    },
    {
      "count": 11,
      "id": "p44",
      "variantId": "dew"
    },
    {
      "count": 12,
      "id": "p45",
      "variantId": "dew"
    },
    {
      "count": 9,
      "id": "p46",
      "variantId": "moss"
    },
    {
      "count": 15,
      "id": "p47",
      "variantId": "moss"
    },
    {
      "count": 14,
      "id": "p48",
      "variantId": "moss"
    },
    {
      "count": 14,
      "id": "p49",
      "variantId": "berry"
    },
    {
      "count": 15,
      "id": "p50",
      "variantId": "berry"
    }
  ],
  "rewardProfile": "standard",
  "seed": "16909841923457748152",
  "slots": {
    "count": 5,
    "locked": {
      "keyId": "k1",
      "slotIndex": 4
    }
  },
  "tray": {
    "stacks": [
      ["p01", "p07", "p13", "p19", "p25", "p31", "p37", "p43", "p49"],
      ["p02", "p08", "p14", "p20", "p26", "p32", "p38", "p44", "p50"],
      ["p03", "p09", "p15", "p21", "p27", "p33", "p39", "p45"],
      ["p04", "p10", "p16", "p22", "p28", "p34", "p40", "p46"],
      ["p05", "p11", "p17", "p23", "p29", "p35", "p41", "p47"],
      ["p06", "p12", "p18", "p24", "p30", "p36", "p42", "p48"]
    ]
  }
}
