{
  "boardLook": "icons",
  "definitionVersion": 1,
  "difficulty": {
    "class": "normal",
    "score": 2385
  },
  "entries": [
    {
      "side": "bottom",
      "x": 1,
      "y": 0
    }
  ],
  "generatorVersion": "gen-1.3.0",
  "levelNumber": 2581,
  "locks": [
    {
      "keyId": "k1",
      "target": {
        "id": "4",
        "kind": "slot"
      }
    }
  ],
  "mapping": {
    "blanket": "flower",
    "board": "wood",
    "bumps": "leaf",
    "cloud": "dew",
    "cucumber": "leaf",
    "flesh": "dew",
    "flower": "vine",
    "hill": "flower",
    "rind": "moss",
    "seeds": "moss",
    "sky": "dew",
    "stalk": "wood"
  },
  "mechanics": ["connected_pair", "locked_slot"],
  "overlays": {
    "cells": [
      {
        "keyId": "k1",
        "x": 3,
        "y": 20
      }
    ]
  },
  "picture": {
    "id": "cucumber_08",
    "version": 1
  },
  "pods": [
    {
      "count": 10,
      "id": "p01",
      "variantId": "flower"
    },
    {
      "count": 9,
      "id": "p02",
      "variantId": "flower"
    },
    {
      "count": 10,
      "id": "p03",
      "variantId": "flower"
    },
    {
      "count": 9,
      "id": "p04",
      "variantId": "flower"
    },
    {
      "count": 9,
      "id": "p05",
      "variantId": "flower"
    },
    {
      "count": 10,
      "id": "p06",
      "variantId": "flower"
    },
    {
      "count": 8,
      "id": "p07",
      "variantId": "flower"
    },
    {
      "connectedGroupId": "c1",
      "count": 11,
      "id": "p08",
      "variantId": "flower"
    },
    {
      "connectedGroupId": "c1",
      "count": 12,
      "id": "p09",
      "variantId": "wood"
    },
    {
      "count": 10,
      "id": "p10",
      "variantId": "wood"
    },
    {
      "count": 11,
      "id": "p11",
      "variantId": "wood"
    },
    {
      "count": 11,
      "id": "p12",
      "variantId": "wood"
    },
    {
      "count": 9,
      "id": "p13",
      "variantId": "dew"
    },
    {
      "count": 11,
      "id": "p14",
      "variantId": "dew"
    },
    {
      "count": 11,
      "id": "p15",
      "variantId": "dew"
    },
    {
      "count": 10,
      "id": "p16",
      "variantId": "dew"
    },
    {
      "count": 19,
      "id": "p17",
      "variantId": "dew"
    },
    {
      "count": 9,
      "id": "p18",
      "variantId": "dew"
    },
    {
      "count": 12,
      "id": "p19",
      "variantId": "dew"
    },
    {
      "count": 18,
      "id": "p20",
      "variantId": "dew"
    },
    {
      "count": 11,
      "id": "p21",
      "variantId": "dew"
    },
    {
      "count": 10,
      "id": "p22",
      "variantId": "dew"
    },
    {
      "count": 10,
      "id": "p23",
      "variantId": "dew"
    },
    {
      "count": 11,
      "id": "p24",
      "variantId": "dew"
    },
    {
      "count": 10,
      "id": "p25",
      "variantId": "dew"
    },
    {
      "count": 11,
      "id": "p26",
      "variantId": "dew"
    },
    {
      "count": 13,
      "id": "p27",
      "variantId": "moss"
    },
    {
      "count": 12,
      "id": "p28",
      "variantId": "moss"
    },
    {
      "count": 12,
      "id": "p29",
      "variantId": "moss"
    },
    {
      "count": 15,
      "id": "p30",
      "variantId": "moss"
    },
    {
      "count": 10,
      "id": "p31",
      "variantId": "dew"
    },
    {
      "count": 11,
      "id": "p32",
      "variantId": "dew"
    },
    {
      "count": 10,
      "id": "p33",
      "variantId": "leaf"
    },
    {
      "count": 10,
      "id": "p34",
      "variantId": "leaf"
    },
    {
      "count": 10,
      "id": "p35",
      "variantId": "leaf"
    },
    {
      "count": 10,
      "id": "p36",
      "variantId": "leaf"
    },
    {
      "count": 6,
      "id": "p37",
      "variantId": "vine"
    },
    {
      "count": 5,
      "id": "p38",
      "variantId": "wood"
    }
  ],
  "rewardProfile": "standard",
  "seed": "8775268006391043785",
  "slots": {
    "count": 5,
    "locked": {
      "keyId": "k1",
      "slotIndex": 4
    }
  },
  "tray": {
    "stacks": [
      ["p01", "p07", "p13", "p19", "p25", "p31", "p37"],
      ["p02", "p08", "p14", "p20", "p26", "p32", "p38"],
      ["p03", "p09", "p15", "p21", "p27", "p33"],
      ["p04", "p10", "p16", "p22", "p28", "p34"],
      ["p05", "p11", "p17", "p23", "p29", "p35"],
      ["p06", "p12", "p18", "p24", "p30", "p36"]
    ]
  }
}
