{
  "boardLook": "icons",
  "definitionVersion": 2,
  "difficulty": {
    "class": "normal",
    "score": 2676
  },
  "entries": [
    {
      "side": "right",
      "x": 23,
      "y": 9
    }
  ],
  "generatorVersion": "gen-1.6.0",
  "levelNumber": 419,
  "mapping": {
    "light": "vine",
    "petal": "violet_bud",
    "shadow": "moss",
    "sky": "dew",
    "wood": "wood"
  },
  "picture": {
    "id": "accordion_seed_sorter",
    "version": 1
  },
  "pods": [
    {
      "count": 18,
      "id": "p01",
      "variantId": "dew"
    },
    {
      "count": 18,
      "id": "p02",
      "variantId": "dew"
    },
    {
      "count": 10,
      "id": "p03",
      "variantId": "dew"
    },
    {
      "count": 10,
      "id": "p04",
      "variantId": "dew"
    },
    {
      "count": 18,
      "id": "p05",
      "variantId": "dew"
    },
    {
      "count": 9,
      "id": "p06",
      "variantId": "dew"
    },
    {
      "count": 11,
      "id": "p07",
      "variantId": "dew"
    },
    {
      "count": 18,
      "id": "p08",
      "variantId": "dew"
    },
    {
      "count": 8,
      "id": "p09",
      "variantId": "dew"
    },
    {
      "count": 11,
      "id": "p10",
      "variantId": "dew"
    },
    {
      "count": 17,
      "id": "p11",
      "variantId": "dew"
    },
    {
      "count": 18,
      "id": "p12",
      "variantId": "dew"
    },
    {
      "count": 18,
      "id": "p13",
      "variantId": "dew"
    },
    {
      "count": 10,
      "id": "p14",
      "variantId": "dew"
    },
    {
      "count": 9,
      "id": "p15",
      "variantId": "dew"
    },
    {
      "count": 19,
      "id": "p16",
      "variantId": "dew"
    },
    {
      "count": 14,
      "id": "p17",
      "variantId": "moss"
    },
    {
      "count": 15,
      "id": "p18",
      "variantId": "moss"
    },
    {
      "count": 15,
      "id": "p19",
      "variantId": "moss"
    },
    {
      "count": 13,
      "id": "p20",
      "variantId": "moss"
    },
    {
      "count": 14,
      "id": "p21",
      "variantId": "moss"
    },
    {
      "count": 13,
      "id": "p22",
      "variantId": "moss"
    },
    {
      "count": 15,
      "id": "p23",
      "variantId": "moss"
    },
    {
      "count": 15,
      "id": "p24",
      "variantId": "moss"
    },
    {
      "count": 15,
      "id": "p25",
      "variantId": "wood"
    },
    {
      "count": 13,
      "id": "p26",
      "variantId": "wood"
    },
    {
      "count": 12,
      "id": "p27",
      "variantId": "wood"
    },
    {
      "count": 14,
      "id": "p28",
      "variantId": "wood"
    },
    {
      "count": 13,
      "id": "p29",
      "variantId": "wood"
    },
    {
      "count": 15,
      "id": "p30",
      "variantId": "wood"
    },
    {
      "count": 14,
      "id": "p31",
      "variantId": "wood"
    },
    {
      "count": 12,
      "id": "p32",
      "variantId": "wood"
    },
    {
      "count": 15,
      "id": "p33",
      "variantId": "vine"
    },
    {
      "count": 18,
      "id": "p34",
      "variantId": "vine"
    },
    {
      "count": 18,
      "id": "p35",
      "variantId": "vine"
    },
    {
      "count": 18,
      "id": "p36",
      "variantId": "vine"
    },
    {
      "count": 12,
      "id": "p37",
      "variantId": "violet_bud"
    },
    {
      "count": 11,
      "id": "p38",
      "variantId": "violet_bud"
    },
    {
      "count": 11,
      "id": "p39",
      "variantId": "violet_bud"
    },
    {
      "count": 14,
      "id": "p40",
      "variantId": "violet_bud"
    },
    {
      "count": 7,
      "id": "p41",
      "variantId": "moss"
    }
  ],
  "rewardProfile": "standard",
  "seed": "9614509412012589435",
  "slots": {
    "count": 5
  },
  "tray": {
    "stacks": [
      ["p01", "p06", "p11", "p16", "p21", "p34", "p30", "p40"],
      ["p25", "p26", "p27", "p28", "p29", "p31"],
      ["p02", "p07", "p12", "p17", "p22", "p35", "p32"],
      ["p03", "p08", "p13", "p18", "p23", "p36", "p37"],
      ["p04", "p09", "p14", "p19", "p24", "p41", "p38"],
      ["p05", "p10", "p15", "p20", "p33", "p39"]
    ]
  }
}
