{
  "boardLook": "peek",
  "definitionVersion": 1,
  "difficulty": {
    "class": "normal",
    "score": 2049
  },
  "entries": [
    {
      "side": "bottom",
      "x": 4,
      "y": 0
    },
    {
      "side": "bottom",
      "x": 11,
      "y": 0
    }
  ],
  "generatorVersion": "gen-1.3.0",
  "levelNumber": 3786,
  "mapping": {
    "body": "flower",
    "helmet": "wood",
    "kerb": "violet_bud",
    "kerb2": "acorn",
    "number": "water",
    "track": "water",
    "tyre": "wood",
    "verge": "leaf",
    "wing": "leaf"
  },
  "mechanics": ["connected_pair"],
  "picture": {
    "id": "race_car_03",
    "mirror": "horizontal",
    "version": 1
  },
  "pods": [
    {
      "count": 10,
      "id": "p01",
      "variantId": "flower"
    },
    {
      "count": 10,
      "id": "p02",
      "variantId": "flower"
    },
    {
      "count": 8,
      "id": "p03",
      "variantId": "acorn"
    },
    {
      "count": 10,
      "id": "p04",
      "variantId": "leaf"
    },
    {
      "count": 10,
      "id": "p05",
      "variantId": "water"
    },
    {
      "count": 7,
      "id": "p06",
      "variantId": "water"
    },
    {
      "count": 6,
      "id": "p07",
      "variantId": "water"
    },
    {
      "count": 10,
      "id": "p08",
      "variantId": "wood"
    },
    {
      "count": 6,
      "id": "p09",
      "variantId": "water"
    },
    {
      "count": 12,
      "id": "p10",
      "variantId": "water"
    },
    {
      "count": 7,
      "id": "p11",
      "variantId": "water"
    },
    {
      "count": 5,
      "id": "p12",
      "variantId": "water"
    },
    {
      "count": 8,
      "id": "p13",
      "variantId": "water"
    },
    {
      "count": 11,
      "id": "p14",
      "variantId": "water"
    },
    {
      "count": 12,
      "id": "p15",
      "variantId": "water"
    },
    {
      "count": 8,
      "id": "p16",
      "variantId": "flower"
    },
    {
      "connectedGroupId": "c1",
      "count": 9,
      "id": "p17",
      "variantId": "leaf"
    },
    {
      "connectedGroupId": "c1",
      "count": 7,
      "id": "p18",
      "variantId": "water"
    },
    {
      "count": 7,
      "id": "p19",
      "variantId": "water"
    },
    {
      "count": 8,
      "id": "p20",
      "variantId": "flower"
    },
    {
      "count": 13,
      "id": "p21",
      "variantId": "wood"
    },
    {
      "count": 9,
      "id": "p22",
      "variantId": "violet_bud"
    },
    {
      "count": 7,
      "id": "p23",
      "variantId": "violet_bud"
    },
    {
      "count": 9,
      "id": "p24",
      "variantId": "leaf"
    },
    {
      "count": 12,
      "id": "p25",
      "variantId": "leaf"
    },
    {
      "count": 8,
      "id": "p26",
      "variantId": "acorn"
    }
  ],
  "rewardProfile": "standard",
  "seed": "12206295783582530235",
  "slots": {
    "count": 5
  },
  "tray": {
    "stacks": [
      ["p01", "p03", "p05", "p07", "p09", "p11", "p13", "p15", "p17", "p19", "p21", "p23", "p25"],
      ["p02", "p04", "p06", "p08", "p10", "p12", "p14", "p16", "p18", "p20", "p22", "p24", "p26"]
    ]
  }
}
