{
  "boardLook": "icons",
  "definitionVersion": 2,
  "difficulty": {
    "class": "normal",
    "score": 2711
  },
  "entries": [
    {
      "side": "bottom",
      "x": 30,
      "y": 0
    }
  ],
  "generatorVersion": "gen-1.6.0",
  "levelNumber": 2412,
  "mapping": {
    "leaf": "leaf",
    "light": "vine",
    "petal": "flower",
    "shadow": "moss",
    "sky": "dew",
    "wood": "acorn"
  },
  "overlays": {
    "cells": [
      {
        "stone": true,
        "x": 29,
        "y": 20
      },
      {
        "hole": true,
        "x": 28,
        "y": 21
      },
      {
        "hole": true,
        "x": 29,
        "y": 21
      },
      {
        "hole": true,
        "x": 30,
        "y": 21
      },
      {
        "hole": true,
        "x": 28,
        "y": 22
      },
      {
        "hole": true,
        "x": 29,
        "y": 22
      },
      {
        "hole": true,
        "x": 30,
        "y": 22
      },
      {
        "stone": true,
        "x": 27,
        "y": 23
      },
      {
        "hole": true,
        "x": 28,
        "y": 23
      },
      {
        "hole": true,
        "x": 29,
        "y": 23
      },
      {
        "hole": true,
        "x": 30,
        "y": 23
      }
    ]
  },
  "picture": {
    "id": "honey_jar_planetarium",
    "version": 1
  },
  "pods": [
    {
      "count": 14,
      "id": "p01",
      "variantId": "dew"
    },
    {
      "count": 14,
      "id": "p02",
      "variantId": "dew"
    },
    {
      "count": 13,
      "id": "p03",
      "variantId": "dew"
    },
    {
      "count": 14,
      "id": "p04",
      "variantId": "dew"
    },
    {
      "count": 13,
      "id": "p05",
      "variantId": "dew"
    },
    {
      "count": 14,
      "id": "p06",
      "variantId": "dew"
    },
    {
      "count": 13,
      "id": "p07",
      "variantId": "dew"
    },
    {
      "count": 15,
      "id": "p08",
      "variantId": "dew"
    },
    {
      "count": 14,
      "id": "p09",
      "variantId": "dew"
    },
    {
      "count": 15,
      "id": "p10",
      "variantId": "dew"
    },
    {
      "count": 14,
      "id": "p11",
      "variantId": "dew"
    },
    {
      "count": 13,
      "id": "p12",
      "variantId": "dew"
    },
    {
      "count": 15,
      "id": "p13",
      "variantId": "dew"
    },
    {
      "count": 13,
      "id": "p14",
      "variantId": "dew"
    },
    {
      "count": 13,
      "id": "p15",
      "variantId": "dew"
    },
    {
      "count": 13,
      "id": "p16",
      "variantId": "dew"
    },
    {
      "count": 13,
      "id": "p17",
      "variantId": "moss"
    },
    {
      "count": 14,
      "id": "p18",
      "variantId": "moss"
    },
    {
      "count": 12,
      "id": "p19",
      "variantId": "moss"
    },
    {
      "count": 14,
      "id": "p20",
      "variantId": "moss"
    },
    {
      "count": 14,
      "id": "p21",
      "variantId": "moss"
    },
    {
      "count": 15,
      "id": "p22",
      "variantId": "moss"
    },
    {
      "count": 12,
      "id": "p23",
      "variantId": "moss"
    },
    {
      "count": 15,
      "id": "p24",
      "variantId": "moss"
    },
    {
      "count": 13,
      "id": "p25",
      "variantId": "moss"
    },
    {
      "count": 14,
      "id": "p26",
      "variantId": "moss"
    },
    {
      "count": 13,
      "id": "p27",
      "variantId": "moss"
    },
    {
      "count": 15,
      "id": "p28",
      "variantId": "moss"
    },
    {
      "count": 14,
      "id": "p29",
      "variantId": "moss"
    },
    {
      "count": 12,
      "id": "p30",
      "variantId": "moss"
    },
    {
      "count": 13,
      "id": "p31",
      "variantId": "moss"
    },
    {
      "count": 14,
      "id": "p32",
      "variantId": "moss"
    },
    {
      "count": 13,
      "id": "p33",
      "variantId": "moss"
    },
    {
      "count": 12,
      "id": "p34",
      "variantId": "moss"
    },
    {
      "count": 15,
      "id": "p35",
      "variantId": "moss"
    },
    {
      "count": 13,
      "id": "p36",
      "variantId": "moss"
    },
    {
      "count": 15,
      "id": "p37",
      "variantId": "moss"
    },
    {
      "count": 13,
      "id": "p38",
      "variantId": "moss"
    },
    {
      "count": 14,
      "id": "p39",
      "variantId": "moss"
    },
    {
      "count": 13,
      "id": "p40",
      "variantId": "moss"
    },
    {
      "count": 12,
      "id": "p41",
      "variantId": "vine"
    },
    {
      "count": 15,
      "id": "p42",
      "variantId": "vine"
    },
    {
      "count": 12,
      "id": "p43",
      "variantId": "vine"
    },
    {
      "count": 13,
      "id": "p44",
      "variantId": "vine"
    },
    {
      "count": 12,
      "id": "p45",
      "variantId": "vine"
    },
    {
      "count": 15,
      "id": "p46",
      "variantId": "vine"
    },
    {
      "count": 13,
      "id": "p47",
      "variantId": "vine"
    },
    {
      "count": 14,
      "id": "p48",
      "variantId": "vine"
    },
    {
      "count": 12,
      "id": "p49",
      "variantId": "flower"
    },
    {
      "count": 15,
      "id": "p50",
      "variantId": "flower"
    },
    {
      "count": 16,
      "id": "p51",
      "variantId": "flower"
    },
    {
      "count": 14,
      "id": "p52",
      "variantId": "flower"
    },
    {
      "count": 12,
      "id": "p53",
      "variantId": "flower"
    },
    {
      "count": 14,
      "id": "p54",
      "variantId": "flower"
    },
    {
      "count": 15,
      "id": "p55",
      "variantId": "flower"
    },
    {
      "count": 14,
      "id": "p56",
      "variantId": "flower"
    },
    {
      "count": 9,
      "id": "p57",
      "variantId": "acorn"
    },
    {
      "count": 11,
      "id": "p58",
      "variantId": "acorn"
    },
    {
      "count": 18,
      "id": "p59",
      "variantId": "acorn"
    },
    {
      "count": 8,
      "id": "p60",
      "variantId": "acorn"
    },
    {
      "count": 11,
      "id": "p61",
      "variantId": "acorn"
    },
    {
      "count": 8,
      "id": "p62",
      "variantId": "acorn"
    },
    {
      "count": 11,
      "id": "p63",
      "variantId": "acorn"
    },
    {
      "count": 17,
      "id": "p64",
      "variantId": "leaf"
    },
    {
      "count": 8,
      "id": "p65",
      "variantId": "leaf"
    },
    {
      "count": 11,
      "id": "p66",
      "variantId": "leaf"
    },
    {
      "count": 10,
      "id": "p67",
      "variantId": "moss"
    }
  ],
  "rewardProfile": "standard",
  "seed": "8762570363001704170",
  "slots": {
    "count": 5
  },
  "tray": {
    "stacks": [
      ["p01", "p05", "p09", "p13", "p17", "p21", "p25", "p29", "p33", "p37", "p67", "p46", "p51", "p56", "p61", "p66"],
      ["p41", "p42", "p43", "p44", "p45", "p47", "p52", "p57", "p62"],
      ["p02", "p06", "p10", "p14", "p18", "p22", "p26", "p30", "p34", "p38", "p48", "p53", "p58", "p63"],
      ["p03", "p07", "p11", "p15", "p19", "p23", "p27", "p31", "p35", "p39", "p49", "p54", "p59", "p64"],
      ["p04", "p08", "p12", "p16", "p20", "p24", "p28", "p32", "p36", "p40", "p50", "p55", "p60", "p65"]
    ]
  }
}
