{
  "boardLook": "icons",
  "definitionVersion": 2,
  "difficulty": {
    "class": "normal",
    "score": 1670
  },
  "entries": [
    {
      "side": "left",
      "x": 0,
      "y": 9
    }
  ],
  "generatorVersion": "gen-1.6.0",
  "levelNumber": 1965,
  "mapping": {
    "light": "vine",
    "petal": "violet_bud",
    "shadow": "moss",
    "sky": "dew",
    "wood": "acorn"
  },
  "mechanics": ["gate"],
  "overlays": {
    "cells": [
      {
        "hole": true,
        "x": 15,
        "y": 6
      },
      {
        "hole": true,
        "x": 16,
        "y": 6
      },
      {
        "hole": true,
        "x": 17,
        "y": 6
      },
      {
        "hole": true,
        "x": 15,
        "y": 7
      },
      {
        "hole": true,
        "x": 16,
        "y": 7
      },
      {
        "hole": true,
        "x": 17,
        "y": 7
      },
      {
        "hole": true,
        "x": 15,
        "y": 8
      },
      {
        "hole": true,
        "x": 16,
        "y": 8
      },
      {
        "hole": true,
        "x": 17,
        "y": 8
      }
    ]
  },
  "picture": {
    "id": "light_bulb_clockwork",
    "version": 1
  },
  "pods": [
    {
      "count": 11,
      "id": "p01",
      "variantId": "dew"
    },
    {
      "count": 9,
      "id": "p02",
      "variantId": "dew"
    },
    {
      "count": 9,
      "id": "p03",
      "variantId": "dew"
    },
    {
      "count": 10,
      "id": "p04",
      "variantId": "dew"
    },
    {
      "count": 9,
      "id": "p05",
      "variantId": "dew"
    },
    {
      "count": 10,
      "id": "p06",
      "variantId": "dew"
    },
    {
      "count": 19,
      "id": "p07",
      "variantId": "dew"
    },
    {
      "count": 19,
      "id": "p08",
      "variantId": "dew"
    },
    {
      "count": 9,
      "id": "p09",
      "variantId": "dew"
    },
    {
      "count": 11,
      "id": "p10",
      "variantId": "dew"
    },
    {
      "count": 18,
      "id": "p11",
      "variantId": "dew"
    },
    {
      "count": 9,
      "id": "p12",
      "variantId": "dew"
    },
    {
      "count": 11,
      "id": "p13",
      "variantId": "dew"
    },
    {
      "count": 10,
      "id": "p14",
      "variantId": "vine"
    },
    {
      "count": 13,
      "id": "p15",
      "variantId": "vine"
    },
    {
      "count": 11,
      "id": "p16",
      "variantId": "vine"
    },
    {
      "count": 12,
      "id": "p17",
      "variantId": "vine"
    },
    {
      "count": 10,
      "id": "p18",
      "variantId": "vine"
    },
    {
      "count": 12,
      "id": "p19",
      "variantId": "vine"
    },
    {
      "count": 10,
      "id": "p20",
      "variantId": "vine"
    },
    {
      "count": 12,
      "id": "p21",
      "variantId": "vine"
    },
    {
      "count": 10,
      "id": "p22",
      "variantId": "vine"
    },
    {
      "count": 10,
      "id": "p23",
      "variantId": "vine"
    },
    {
      "count": 12,
      "id": "p24",
      "variantId": "vine"
    },
    {
      "count": 11,
      "id": "p25",
      "variantId": "vine"
    },
    {
      "count": 12,
      "id": "p26",
      "variantId": "vine"
    },
    {
      "count": 10,
      "id": "p27",
      "variantId": "vine"
    },
    {
      "count": 12,
      "id": "p28",
      "variantId": "vine"
    },
    {
      "count": 12,
      "id": "p29",
      "variantId": "vine"
    },
    {
      "count": 13,
      "id": "p30",
      "variantId": "violet_bud"
    },
    {
      "count": 11,
      "id": "p31",
      "variantId": "violet_bud"
    },
    {
      "count": 11,
      "id": "p32",
      "variantId": "violet_bud"
    },
    {
      "count": 13,
      "id": "p33",
      "variantId": "violet_bud"
    },
    {
      "count": 10,
      "id": "p34",
      "variantId": "violet_bud"
    },
    {
      "count": 13,
      "id": "p35",
      "variantId": "violet_bud"
    },
    {
      "count": 13,
      "id": "p36",
      "variantId": "violet_bud"
    },
    {
      "count": 11,
      "id": "p37",
      "variantId": "violet_bud"
    },
    {
      "count": 9,
      "id": "p38",
      "variantId": "acorn"
    },
    {
      "count": 12,
      "id": "p39",
      "variantId": "acorn"
    },
    {
      "count": 19,
      "id": "p40",
      "variantId": "acorn"
    },
    {
      "count": 10,
      "id": "p41",
      "variantId": "vine"
    },
    {
      "count": 13,
      "id": "p42",
      "variantId": "vine"
    },
    {
      "count": 16,
      "id": "p43",
      "variantId": "moss"
    }
  ],
  "rewardProfile": "standard",
  "seed": "2785229047952058983",
  "slots": {
    "count": 5
  },
  "specials": [
    {
      "cells": [
        {
          "x": 15,
          "y": 6
        },
        {
          "x": 16,
          "y": 6
        },
        {
          "x": 17,
          "y": 6
        },
        {
          "x": 15,
          "y": 7
        },
        {
          "x": 16,
          "y": 7
        },
        {
          "x": 17,
          "y": 7
        },
        {
          "x": 15,
          "y": 8
        },
        {
          "x": 16,
          "y": 8
        },
        {
          "x": 17,
          "y": 8
        }
      ],
      "condition": {
        "count": 2,
        "kind": "clear_count_adjacent"
      },
      "effect": {
        "kind": "open_cells"
      },
      "id": "gate",
      "type": "gate"
    }
  ],
  "tray": {
    "stacks": [
      ["p01", "p03", "p05", "p07", "p09", "p11", "p13", "p15", "p17", "p19", "p21", "p23", "p25", "p27", "p29", "p42", "p35", "p38"],
      ["p30", "p31", "p32", "p33", "p34", "p36", "p39"],
      ["p02", "p04", "p06", "p08", "p10", "p12", "p14", "p16", "p18", "p20", "p22", "p24", "p26", "p28", "p41", "p43", "p37", "p40"]
    ]
  }
}
