{
  "boardLook": "icons",
  "definitionVersion": 1,
  "difficulty": {
    "class": "hard",
    "score": 2887
  },
  "entries": [
    {
      "side": "bottom",
      "x": 4,
      "y": 0
    },
    {
      "side": "bottom",
      "x": 14,
      "y": 0
    }
  ],
  "generatorVersion": "gen-1.3.0",
  "levelNumber": 3706,
  "mapping": {
    "band": "leaf",
    "bowl": "berry",
    "chopsticks": "wood",
    "noodles": "vine",
    "shelf": "leaf",
    "steam": "water",
    "strands": "wood",
    "table": "wood",
    "wall": "flower",
    "wall_dots": "flower"
  },
  "picture": {
    "id": "noodles_10",
    "mirror": "horizontal",
    "version": 1
  },
  "pods": [
    {
      "count": 8,
      "id": "p01",
      "variantId": "flower"
    },
    {
      "count": 8,
      "id": "p02",
      "variantId": "wood"
    },
    {
      "count": 6,
      "id": "p03",
      "variantId": "wood"
    },
    {
      "count": 6,
      "id": "p04",
      "variantId": "wood"
    },
    {
      "count": 9,
      "id": "p05",
      "variantId": "wood"
    },
    {
      "count": 8,
      "id": "p06",
      "variantId": "water"
    },
    {
      "count": 8,
      "id": "p07",
      "variantId": "wood"
    },
    {
      "count": 10,
      "id": "p08",
      "variantId": "wood"
    },
    {
      "count": 8,
      "id": "p09",
      "variantId": "vine"
    },
    {
      "count": 7,
      "id": "p10",
      "variantId": "flower"
    },
    {
      "count": 7,
      "id": "p11",
      "variantId": "wood"
    },
    {
      "count": 6,
      "id": "p12",
      "variantId": "flower"
    },
    {
      "count": 7,
      "id": "p13",
      "variantId": "wood"
    },
    {
      "count": 6,
      "id": "p14",
      "variantId": "wood"
    },
    {
      "count": 6,
      "id": "p15",
      "variantId": "flower"
    },
    {
      "count": 12,
      "id": "p16",
      "variantId": "flower"
    },
    {
      "count": 12,
      "id": "p17",
      "variantId": "flower"
    },
    {
      "count": 7,
      "id": "p18",
      "variantId": "flower"
    },
    {
      "count": 11,
      "id": "p19",
      "variantId": "flower"
    },
    {
      "count": 6,
      "id": "p20",
      "variantId": "flower"
    },
    {
      "count": 8,
      "id": "p21",
      "variantId": "flower"
    },
    {
      "count": 7,
      "id": "p22",
      "variantId": "flower"
    },
    {
      "count": 6,
      "id": "p23",
      "variantId": "flower"
    },
    {
      "count": 6,
      "id": "p24",
      "variantId": "leaf"
    },
    {
      "count": 12,
      "id": "p25",
      "variantId": "flower"
    },
    {
      "count": 8,
      "id": "p26",
      "variantId": "vine"
    },
    {
      "count": 5,
      "id": "p27",
      "variantId": "flower"
    },
    {
      "count": 8,
      "id": "p28",
      "variantId": "flower"
    },
    {
      "count": 7,
      "id": "p29",
      "variantId": "berry"
    },
    {
      "count": 8,
      "id": "p30",
      "variantId": "flower"
    },
    {
      "count": 6,
      "id": "p31",
      "variantId": "flower"
    },
    {
      "count": 12,
      "id": "p32",
      "variantId": "flower"
    },
    {
      "count": 12,
      "id": "p33",
      "variantId": "flower"
    },
    {
      "count": 5,
      "id": "p34",
      "variantId": "flower"
    },
    {
      "count": 8,
      "id": "p35",
      "variantId": "flower"
    },
    {
      "count": 6,
      "id": "p36",
      "variantId": "flower"
    },
    {
      "count": 12,
      "id": "p37",
      "variantId": "flower"
    },
    {
      "count": 6,
      "id": "p38",
      "variantId": "flower"
    },
    {
      "count": 7,
      "id": "p39",
      "variantId": "flower"
    },
    {
      "count": 11,
      "id": "p40",
      "variantId": "wood"
    },
    {
      "count": 10,
      "id": "p41",
      "variantId": "vine"
    },
    {
      "count": 11,
      "id": "p42",
      "variantId": "vine"
    },
    {
      "count": 7,
      "id": "p43",
      "variantId": "leaf"
    },
    {
      "count": 11,
      "id": "p44",
      "variantId": "leaf"
    },
    {
      "count": 6,
      "id": "p45",
      "variantId": "berry"
    },
    {
      "count": 8,
      "id": "p46",
      "variantId": "berry"
    },
    {
      "count": 12,
      "id": "p47",
      "variantId": "berry"
    },
    {
      "count": 8,
      "id": "p48",
      "variantId": "berry"
    },
    {
      "count": 7,
      "id": "p49",
      "variantId": "berry"
    },
    {
      "count": 7,
      "id": "p50",
      "variantId": "berry"
    }
  ],
  "rewardProfile": "standard",
  "seed": "16856082478378968352",
  "slots": {
    "count": 5
  },
  "tray": {
    "stacks": [
      ["p01", "p04", "p07", "p10", "p13", "p16", "p19", "p22", "p25", "p28", "p31", "p34", "p37", "p40", "p43", "p46", "p49"],
      ["p02", "p05", "p08", "p11", "p14", "p17", "p20", "p23", "p26", "p29", "p32", "p35", "p38", "p41", "p44", "p47", "p50"],
      ["p03", "p06", "p09", "p12", "p15", "p18", "p21", "p24", "p27", "p30", "p33", "p36", "p39", "p42", "p45", "p48"]
    ]
  }
}
