{
  "boardLook": "icons",
  "definitionVersion": 1,
  "difficulty": {
    "class": "normal",
    "score": 2067
  },
  "entries": [
    {
      "side": "bottom",
      "x": 16,
      "y": 0
    }
  ],
  "generatorVersion": "gen-1.3.0",
  "levelNumber": 3043,
  "locks": [
    {
      "keyId": "k1",
      "target": {
        "id": "p21",
        "kind": "pod"
      }
    }
  ],
  "mapping": {
    "buzz": "water",
    "fly": "wood",
    "mouth": "violet_bud",
    "pot": "acorn",
    "rim": "violet_bud",
    "sill": "leaf",
    "sky": "dew",
    "teeth": "leaf",
    "trap": "leaf",
    "wings": "water"
  },
  "mechanics": ["locked_pod"],
  "overlays": {
    "cells": [
      {
        "keyId": "k1",
        "x": 14,
        "y": 15
      }
    ]
  },
  "picture": {
    "id": "venus_flytrap_05",
    "version": 1
  },
  "pods": [
    {
      "count": 17,
      "id": "p01",
      "variantId": "leaf"
    },
    {
      "count": 19,
      "id": "p02",
      "variantId": "leaf"
    },
    {
      "count": 18,
      "id": "p03",
      "variantId": "dew"
    },
    {
      "count": 19,
      "id": "p04",
      "variantId": "dew"
    },
    {
      "count": 19,
      "id": "p05",
      "variantId": "dew"
    },
    {
      "count": 10,
      "id": "p06",
      "variantId": "dew"
    },
    {
      "count": 11,
      "id": "p07",
      "variantId": "dew"
    },
    {
      "count": 9,
      "id": "p08",
      "variantId": "dew"
    },
    {
      "count": 11,
      "id": "p09",
      "variantId": "dew"
    },
    {
      "count": 19,
      "id": "p10",
      "variantId": "dew"
    },
    {
      "count": 20,
      "id": "p11",
      "variantId": "dew"
    },
    {
      "count": 18,
      "id": "p12",
      "variantId": "dew"
    },
    {
      "count": 11,
      "id": "p13",
      "variantId": "leaf"
    },
    {
      "count": 10,
      "id": "p14",
      "variantId": "leaf"
    },
    {
      "count": 10,
      "id": "p15",
      "variantId": "leaf"
    },
    {
      "count": 11,
      "id": "p16",
      "variantId": "leaf"
    },
    {
      "count": 11,
      "id": "p17",
      "variantId": "leaf"
    },
    {
      "count": 12,
      "id": "p18",
      "variantId": "leaf"
    },
    {
      "count": 9,
      "id": "p19",
      "variantId": "leaf"
    },
    {
      "count": 12,
      "id": "p20",
      "variantId": "leaf"
    },
    {
      "count": 18,
      "id": "p21",
      "lockKeyId": "k1",
      "variantId": "violet_bud"
    },
    {
      "count": 17,
      "id": "p22",
      "variantId": "violet_bud"
    },
    {
      "count": 14,
      "id": "p23",
      "variantId": "acorn"
    },
    {
      "count": 10,
      "id": "p24",
      "variantId": "water"
    },
    {
      "count": 5,
      "id": "p25",
      "variantId": "wood"
    }
  ],
  "rewardProfile": "standard",
  "seed": "13899005442029714375",
  "slots": {
    "count": 5
  },
  "tray": {
    "stacks": [
      ["p01", "p07", "p13", "p19", "p25"],
      ["p02", "p08", "p14", "p20"],
      ["p03", "p09", "p15", "p21"],
      ["p04", "p10", "p16", "p22"],
      ["p05", "p11", "p17", "p23"],
      ["p06", "p12", "p18", "p24"]
    ]
  }
}
