{
  "boardLook": "icons",
  "definitionVersion": 1,
  "difficulty": {
    "class": "normal",
    "score": 2156
  },
  "entries": [
    {
      "side": "bottom",
      "x": 16,
      "y": 0
    }
  ],
  "generatorVersion": "gen-1.3.0",
  "levelNumber": 3524,
  "locks": [
    {
      "keyId": "k1",
      "target": {
        "id": "4",
        "kind": "slot"
      }
    }
  ],
  "mapping": {
    "basket": "wood",
    "crown": "moss",
    "flowers": "flower",
    "fruit": "violet_bud",
    "grass": "moss",
    "sky": "dew",
    "sun": "acorn",
    "trunk": "wood"
  },
  "mechanics": ["locked_slot"],
  "overlays": {
    "cells": [
      {
        "keyId": "k1",
        "x": 11,
        "y": 20
      }
    ]
  },
  "picture": {
    "id": "fruit_tree_10",
    "mirror": "horizontal",
    "version": 1
  },
  "pods": [
    {
      "count": 13,
      "id": "p01",
      "variantId": "moss"
    },
    {
      "count": 12,
      "id": "p02",
      "variantId": "wood"
    },
    {
      "count": 11,
      "id": "p03",
      "variantId": "moss"
    },
    {
      "count": 9,
      "id": "p04",
      "variantId": "moss"
    },
    {
      "count": 13,
      "id": "p05",
      "variantId": "dew"
    },
    {
      "count": 11,
      "id": "p06",
      "variantId": "moss"
    },
    {
      "count": 9,
      "id": "p07",
      "variantId": "moss"
    },
    {
      "count": 14,
      "id": "p08",
      "variantId": "dew"
    },
    {
      "count": 15,
      "id": "p09",
      "variantId": "dew"
    },
    {
      "count": 16,
      "id": "p10",
      "variantId": "dew"
    },
    {
      "count": 13,
      "id": "p11",
      "variantId": "dew"
    },
    {
      "count": 16,
      "id": "p12",
      "variantId": "dew"
    },
    {
      "count": 5,
      "id": "p13",
      "variantId": "flower"
    },
    {
      "count": 9,
      "id": "p14",
      "variantId": "violet_bud"
    },
    {
      "count": 13,
      "id": "p15",
      "variantId": "dew"
    },
    {
      "count": 16,
      "id": "p16",
      "variantId": "dew"
    },
    {
      "count": 12,
      "id": "p17",
      "variantId": "moss"
    },
    {
      "count": 11,
      "id": "p18",
      "variantId": "moss"
    },
    {
      "count": 10,
      "id": "p19",
      "variantId": "moss"
    },
    {
      "count": 12,
      "id": "p20",
      "variantId": "moss"
    },
    {
      "count": 11,
      "id": "p21",
      "variantId": "moss"
    },
    {
      "count": 12,
      "id": "p22",
      "variantId": "moss"
    },
    {
      "count": 12,
      "id": "p23",
      "variantId": "moss"
    },
    {
      "count": 10,
      "id": "p24",
      "variantId": "violet_bud"
    },
    {
      "count": 9,
      "id": "p25",
      "variantId": "violet_bud"
    },
    {
      "count": 10,
      "id": "p26",
      "variantId": "violet_bud"
    },
    {
      "count": 11,
      "id": "p27",
      "variantId": "wood"
    },
    {
      "count": 9,
      "id": "p28",
      "variantId": "wood"
    },
    {
      "count": 11,
      "id": "p29",
      "variantId": "wood"
    },
    {
      "count": 8,
      "id": "p30",
      "variantId": "acorn"
    }
  ],
  "rewardProfile": "standard",
  "seed": "11153826814547766075",
  "slots": {
    "count": 5,
    "locked": {
      "keyId": "k1",
      "slotIndex": 4
    }
  },
  "tray": {
    "stacks": [
      ["p01", "p04", "p07", "p10", "p13", "p16", "p19", "p22", "p25", "p28"],
      ["p02", "p05", "p08", "p11", "p14", "p17", "p20", "p23", "p26", "p29"],
      ["p03", "p06", "p09", "p12", "p15", "p18", "p21", "p24", "p27", "p30"]
    ]
  }
}
