{
  "boardLook": "peek",
  "definitionVersion": 1,
  "difficulty": {
    "class": "normal",
    "score": 1603
  },
  "entries": [
    {
      "side": "bottom",
      "x": 3,
      "y": 0
    },
    {
      "side": "bottom",
      "x": 10,
      "y": 0
    }
  ],
  "generatorVersion": "gen-1.3.0",
  "levelNumber": 4287,
  "mapping": {
    "ground": "leaf",
    "hills": "moss",
    "hub": "water",
    "load": "wood",
    "ribs": "violet_bud",
    "sky": "dew",
    "sun": "wood",
    "truck": "violet_bud",
    "tyre": "wood",
    "window": "dew"
  },
  "mechanics": ["connected_pair"],
  "picture": {
    "id": "dump_truck_02",
    "version": 1
  },
  "pods": [
    {
      "count": 11,
      "id": "p01",
      "variantId": "leaf"
    },
    {
      "count": 14,
      "id": "p02",
      "variantId": "leaf"
    },
    {
      "count": 12,
      "id": "p03",
      "variantId": "wood"
    },
    {
      "connectedGroupId": "c1",
      "count": 10,
      "id": "p04",
      "variantId": "wood"
    },
    {
      "connectedGroupId": "c1",
      "count": 13,
      "id": "p05",
      "variantId": "moss"
    },
    {
      "count": 11,
      "id": "p06",
      "variantId": "violet_bud"
    },
    {
      "count": 9,
      "id": "p07",
      "variantId": "violet_bud"
    },
    {
      "count": 12,
      "id": "p08",
      "variantId": "violet_bud"
    },
    {
      "count": 10,
      "id": "p09",
      "variantId": "violet_bud"
    },
    {
      "count": 17,
      "id": "p10",
      "variantId": "dew"
    },
    {
      "count": 18,
      "id": "p11",
      "variantId": "dew"
    },
    {
      "count": 19,
      "id": "p12",
      "variantId": "dew"
    },
    {
      "count": 19,
      "id": "p13",
      "variantId": "dew"
    },
    {
      "count": 16,
      "id": "p14",
      "variantId": "wood"
    },
    {
      "count": 5,
      "id": "p15",
      "variantId": "water"
    }
  ],
  "rewardProfile": "standard",
  "seed": "10072682855639048554",
  "slots": {
    "count": 5
  },
  "tray": {
    "stacks": [
      ["p01", "p04", "p07", "p10", "p13"],
      ["p02", "p05", "p08", "p11", "p14"],
      ["p03", "p06", "p09", "p12", "p15"]
    ]
  }
}
