{
  "boardLook": "icons",
  "definitionVersion": 2,
  "difficulty": {
    "class": "normal",
    "score": 1514
  },
  "entries": [
    {
      "side": "bottom",
      "x": 19,
      "y": 0
    }
  ],
  "generatorVersion": "gen-1.6.0",
  "levelNumber": 1857,
  "mapping": {
    "leaf": "leaf",
    "petal": "violet_bud",
    "sky": "dew",
    "wood": "acorn"
  },
  "picture": {
    "id": "lollipop",
    "version": 1
  },
  "pods": [
    {
      "count": 5,
      "id": "p01",
      "variantId": "dew"
    },
    {
      "count": 7,
      "id": "p02",
      "variantId": "dew"
    },
    {
      "count": 11,
      "id": "p03",
      "variantId": "dew"
    },
    {
      "count": 5,
      "id": "p04",
      "variantId": "dew"
    },
    {
      "count": 8,
      "id": "p05",
      "variantId": "dew"
    },
    {
      "count": 12,
      "id": "p06",
      "variantId": "dew"
    },
    {
      "count": 6,
      "id": "p07",
      "variantId": "dew"
    },
    {
      "count": 7,
      "id": "p08",
      "variantId": "dew"
    },
    {
      "count": 11,
      "id": "p09",
      "variantId": "dew"
    },
    {
      "count": 7,
      "id": "p10",
      "variantId": "dew"
    },
    {
      "count": 6,
      "id": "p11",
      "variantId": "dew"
    },
    {
      "count": 12,
      "id": "p12",
      "variantId": "dew"
    },
    {
      "count": 7,
      "id": "p13",
      "variantId": "dew"
    },
    {
      "count": 6,
      "id": "p14",
      "variantId": "dew"
    },
    {
      "count": 12,
      "id": "p15",
      "variantId": "dew"
    },
    {
      "count": 5,
      "id": "p16",
      "variantId": "dew"
    },
    {
      "count": 8,
      "id": "p17",
      "variantId": "dew"
    },
    {
      "count": 11,
      "id": "p18",
      "variantId": "dew"
    },
    {
      "count": 10,
      "id": "p19",
      "variantId": "dew"
    },
    {
      "count": 6,
      "id": "p20",
      "variantId": "dew"
    },
    {
      "count": 7,
      "id": "p21",
      "variantId": "dew"
    },
    {
      "count": 7,
      "id": "p22",
      "variantId": "dew"
    },
    {
      "count": 6,
      "id": "p23",
      "variantId": "dew"
    },
    {
      "count": 11,
      "id": "p24",
      "variantId": "dew"
    },
    {
      "count": 12,
      "id": "p25",
      "variantId": "violet_bud"
    },
    {
      "count": 10,
      "id": "p26",
      "variantId": "violet_bud"
    },
    {
      "count": 11,
      "id": "p27",
      "variantId": "violet_bud"
    },
    {
      "count": 11,
      "id": "p28",
      "variantId": "violet_bud"
    },
    {
      "count": 12,
      "id": "p29",
      "variantId": "violet_bud"
    },
    {
      "count": 11,
      "id": "p30",
      "variantId": "violet_bud"
    },
    {
      "count": 9,
      "id": "p31",
      "variantId": "violet_bud"
    },
    {
      "count": 12,
      "id": "p32",
      "variantId": "violet_bud"
    },
    {
      "count": 10,
      "id": "p33",
      "variantId": "acorn"
    },
    {
      "count": 10,
      "id": "p34",
      "variantId": "acorn"
    },
    {
      "count": 9,
      "id": "p35",
      "variantId": "acorn"
    },
    {
      "count": 10,
      "id": "p36",
      "variantId": "acorn"
    },
    {
      "count": 11,
      "id": "p37",
      "variantId": "acorn"
    },
    {
      "count": 11,
      "id": "p38",
      "variantId": "acorn"
    },
    {
      "count": 9,
      "id": "p39",
      "variantId": "acorn"
    },
    {
      "count": 11,
      "id": "p40",
      "variantId": "acorn"
    },
    {
      "count": 12,
      "id": "p41",
      "variantId": "leaf"
    },
    {
      "count": 7,
      "id": "p42",
      "variantId": "leaf"
    },
    {
      "count": 6,
      "id": "p43",
      "variantId": "leaf"
    },
    {
      "count": 12,
      "id": "p44",
      "variantId": "leaf"
    },
    {
      "count": 7,
      "id": "p45",
      "variantId": "leaf"
    },
    {
      "count": 8,
      "id": "p46",
      "variantId": "leaf"
    }
  ],
  "rewardProfile": "standard",
  "seed": "8457350752087135357",
  "slots": {
    "count": 5
  },
  "tray": {
    "stacks": [
      ["p01", "p02", "p03", "p04", "p05", "p06", "p07", "p08", "p09", "p10", "p11", "p12", "p13", "p14", "p15", "p16", "p17", "p18", "p19", "p20", "p21", "p22", "p23", "p24", "p30", "p32", "p34", "p36", "p38", "p40", "p42", "p44", "p46"],
      ["p25", "p26", "p27", "p28", "p29", "p31", "p33", "p35", "p37", "p39", "p41", "p43", "p45"]
    ]
  }
}
