{
  "boardLook": "icons",
  "definitionVersion": 2,
  "difficulty": {
    "class": "normal",
    "score": 2583
  },
  "entries": [
    {
      "side": "bottom",
      "x": 22,
      "y": 0
    }
  ],
  "generatorVersion": "gen-1.6.0",
  "levelNumber": 1406,
  "mapping": {
    "leaf": "leaf",
    "light": "vine",
    "shadow": "moss",
    "sky": "dew"
  },
  "mechanics": ["stone"],
  "overlays": {
    "cells": [
      {
        "stone": true,
        "x": 7,
        "y": 3
      },
      {
        "stone": true,
        "x": 19,
        "y": 9
      }
    ]
  },
  "picture": {
    "id": "praying_mantis_gardener",
    "version": 1
  },
  "pods": [
    {
      "count": 14,
      "id": "p01",
      "variantId": "dew"
    },
    {
      "count": 13,
      "id": "p02",
      "variantId": "dew"
    },
    {
      "count": 12,
      "id": "p03",
      "variantId": "dew"
    },
    {
      "count": 15,
      "id": "p04",
      "variantId": "dew"
    },
    {
      "count": 12,
      "id": "p05",
      "variantId": "dew"
    },
    {
      "count": 15,
      "id": "p06",
      "variantId": "dew"
    },
    {
      "count": 13,
      "id": "p07",
      "variantId": "dew"
    },
    {
      "count": 12,
      "id": "p08",
      "variantId": "dew"
    },
    {
      "count": 12,
      "id": "p09",
      "variantId": "dew"
    },
    {
      "count": 13,
      "id": "p10",
      "variantId": "dew"
    },
    {
      "count": 13,
      "id": "p11",
      "variantId": "dew"
    },
    {
      "count": 15,
      "id": "p12",
      "variantId": "dew"
    },
    {
      "count": 12,
      "id": "p13",
      "variantId": "dew"
    },
    {
      "count": 14,
      "id": "p14",
      "variantId": "dew"
    },
    {
      "count": 13,
      "id": "p15",
      "variantId": "dew"
    },
    {
      "count": 13,
      "id": "p16",
      "variantId": "dew"
    },
    {
      "count": 13,
      "id": "p17",
      "variantId": "dew"
    },
    {
      "count": 14,
      "id": "p18",
      "variantId": "dew"
    },
    {
      "count": 13,
      "id": "p19",
      "variantId": "dew"
    },
    {
      "count": 13,
      "id": "p20",
      "variantId": "dew"
    },
    {
      "count": 14,
      "id": "p21",
      "variantId": "dew"
    },
    {
      "count": 13,
      "id": "p22",
      "variantId": "dew"
    },
    {
      "count": 11,
      "id": "p23",
      "variantId": "dew"
    },
    {
      "count": 14,
      "id": "p24",
      "variantId": "dew"
    },
    {
      "count": 11,
      "id": "p25",
      "variantId": "leaf"
    },
    {
      "count": 12,
      "id": "p26",
      "variantId": "leaf"
    },
    {
      "count": 14,
      "id": "p27",
      "variantId": "leaf"
    },
    {
      "count": 12,
      "id": "p28",
      "variantId": "leaf"
    },
    {
      "count": 11,
      "id": "p29",
      "variantId": "leaf"
    },
    {
      "count": 12,
      "id": "p30",
      "variantId": "leaf"
    },
    {
      "count": 13,
      "id": "p31",
      "variantId": "leaf"
    },
    {
      "count": 11,
      "id": "p32",
      "variantId": "leaf"
    },
    {
      "count": 14,
      "id": "p33",
      "variantId": "moss"
    },
    {
      "count": 17,
      "id": "p34",
      "variantId": "moss"
    },
    {
      "count": 14,
      "id": "p35",
      "variantId": "moss"
    },
    {
      "count": 16,
      "id": "p36",
      "variantId": "moss"
    },
    {
      "count": 5,
      "id": "p37",
      "variantId": "vine"
    }
  ],
  "rewardProfile": "standard",
  "seed": "14701145304793206768",
  "slots": {
    "count": 5
  },
  "tray": {
    "stacks": [
      ["p01", "p02", "p03", "p04", "p05", "p06", "p07", "p08", "p09", "p10", "p11", "p12", "p13", "p14", "p15", "p16", "p17", "p18", "p19", "p20", "p21", "p22", "p23", "p24", "p30", "p32", "p34", "p36"],
      ["p25", "p26", "p27", "p28", "p29", "p31", "p33", "p35", "p37"]
    ]
  }
}
