{
  "boardLook": "peek",
  "definitionVersion": 1,
  "difficulty": {
    "class": "normal",
    "score": 1715
  },
  "entries": [
    {
      "side": "bottom",
      "x": 7,
      "y": 0
    }
  ],
  "generatorVersion": "gen-1.3.0",
  "levelNumber": 2701,
  "mapping": {
    "apple": "flower",
    "face": "acorn",
    "grass": "moss",
    "leaf": "moss",
    "nose": "violet_bud",
    "sky": "water",
    "spikes": "acorn",
    "sun": "vine"
  },
  "mechanics": ["mystery_tile"],
  "overlays": {
    "cells": [
      {
        "mystery": true,
        "x": 9,
        "y": 3
      },
      {
        "mystery": true,
        "x": 4,
        "y": 14
      }
    ]
  },
  "picture": {
    "id": "hedgehog_10",
    "version": 1
  },
  "pods": [
    {
      "count": 20,
      "id": "p01",
      "variantId": "moss"
    },
    {
      "count": 19,
      "id": "p02",
      "variantId": "moss"
    },
    {
      "count": 17,
      "id": "p03",
      "variantId": "acorn"
    },
    {
      "count": 18,
      "id": "p04",
      "variantId": "acorn"
    },
    {
      "count": 18,
      "id": "p05",
      "variantId": "acorn"
    },
    {
      "count": 17,
      "id": "p06",
      "variantId": "acorn"
    },
    {
      "count": 10,
      "id": "p07",
      "variantId": "water"
    },
    {
      "count": 11,
      "id": "p08",
      "variantId": "water"
    },
    {
      "count": 11,
      "id": "p09",
      "variantId": "water"
    },
    {
      "count": 11,
      "id": "p10",
      "variantId": "water"
    },
    {
      "count": 20,
      "id": "p11",
      "variantId": "water"
    },
    {
      "count": 21,
      "id": "p12",
      "variantId": "water"
    },
    {
      "count": 5,
      "id": "p13",
      "variantId": "moss"
    },
    {
      "count": 5,
      "id": "p14",
      "variantId": "flower"
    },
    {
      "count": 5,
      "id": "p15",
      "variantId": "violet_bud"
    },
    {
      "count": 5,
      "id": "p16",
      "variantId": "vine"
    }
  ],
  "rewardProfile": "standard",
  "seed": "7010290070404545894",
  "slots": {
    "count": 5
  },
  "tray": {
    "stacks": [
      ["p01", "p07", "p13"],
      ["p02", "p08", "p14"],
      ["p03", "p09", "p15"],
      ["p04", "p10", "p16"],
      ["p05", "p11"],
      ["p06", "p12"]
    ]
  }
}
